{
  "schema": "aether.cloudlink.heartbeat",
  "protocol": "aether.cloudlink",
  "message_kind": "heartbeat-ack",
  "gateway_id": "33333333-3333-4333-8333-333333333333",
  "session_id": "44444444-4444-4444-8444-444444444444",
  "session_epoch": "7",
  "credential_generation": "3",
  "observed_at_ms": "1721000000223",
  "cursors": [
    {
      "stream_id": "telemetry",
      "stream_epoch": "4",
      "acknowledged_position": "18"
    }
  ]
}
